{
  "schema_version": "1.0",
  "collector_version": "0.1.0",
  "timestamp": "2026-01-17T09:15:00Z",
  "environment": {
    "label": "kvm"
  },
  "build": {
    "collector": "build",
    "timestamp": "2026-01-17T09:15:00Z",
    "status": "available",
    "errors": [],
    "warnings": [],
    "data": {
      "raw": {},
      "normalized": {
        "manufacturer": "Google",
        "brand": "google",
        "model": "sdk_gphone64_x86_64",
        "device": "emu64xa",
        "product": "sdk_gphone64_x86_64",
        "hardware": "ranchu",
        "board": "goldfish_x86_64",
        "android_version": "14",
        "sdk_int": 34,
        "type": "userdebug"
      }
    }
  },
  "abi": {
    "collector": "abi",
    "timestamp": "2026-01-17T09:15:00Z",
    "status": "available",
    "errors": [],
    "warnings": [],
    "data": {
      "raw": {},
      "normalized": {
        "supported_abis": [
          "x86_64",
          "arm64-v8a",
          "armeabi-v7a"
        ],
        "supported_64_bit_abis": [
          "x86_64",
          "arm64-v8a"
        ],
        "runtime_os_arch": "amd64"
      }
    }
  },
  "cpu": {
    "collector": "cpu",
    "timestamp": "2026-01-17T09:15:00Z",
    "status": "available",
    "errors": [],
    "warnings": [],
    "data": {
      "raw": {},
      "normalized": {
        "cores": 4,
        "model_name": "Intel(R) Core(TM) i7-12700H",
        "features": [
          "sse2",
          "sse4_1",
          "sse4_2",
          "avx",
          "avx2"
        ]
      }
    }
  },
  "gpu": {
    "collector": "gpu",
    "timestamp": "2026-01-17T09:15:00Z",
    "status": "available",
    "errors": [],
    "warnings": [],
    "data": {
      "raw": {},
      "normalized": {
        "vendor": "Google Inc.",
        "renderer": "Android Emulator OpenGL ES Translator (llvmpipe)",
        "version": "OpenGL ES 3.2"
      }
    }
  },
  "vulkan": {
    "collector": "vulkan",
    "timestamp": "2026-01-17T09:15:00Z",
    "status": "available",
    "errors": [],
    "warnings": [],
    "data": {
      "raw": {},
      "normalized": {
        "version": "1.3.231"
      }
    }
  },
  "kernel": {
    "collector": "kernel",
    "timestamp": "2026-01-17T09:15:00Z",
    "status": "available",
    "errors": [],
    "warnings": [],
    "data": {
      "raw": {},
      "normalized": {
        "kernel_release": "5.15.153-android14-11-g4f0",
        "kernel_version": "5.15.153"
      }
    }
  },
  "proc": {
    "collector": "proc",
    "timestamp": "2026-01-17T09:15:00Z",
    "status": "available",
    "errors": [],
    "warnings": [],
    "data": {
      "raw": {},
      "normalized": {}
    }
  },
  "sys": {
    "collector": "sys",
    "timestamp": "2026-01-17T09:15:00Z",
    "status": "available",
    "errors": [],
    "warnings": [],
    "data": {
      "raw": {},
      "normalized": {}
    }
  },
  "hardware_features": {
    "collector": "hardware_features",
    "timestamp": "2026-01-17T09:15:00Z",
    "status": "available",
    "errors": [],
    "warnings": [],
    "data": {
      "raw": {},
      "normalized": {}
    }
  },
  "sensors": {
    "collector": "sensors",
    "timestamp": "2026-01-17T09:15:00Z",
    "status": "available",
    "errors": [],
    "warnings": [],
    "data": {
      "raw": {},
      "normalized": {
        "count": 12,
        "types": [
          "accelerometer",
          "gyroscope"
        ]
      }
    }
  },
  "display": {
    "collector": "display",
    "timestamp": "2026-01-17T09:15:00Z",
    "status": "available",
    "errors": [],
    "warnings": [],
    "data": {
      "raw": {},
      "normalized": {}
    }
  },
  "network": {
    "collector": "network",
    "timestamp": "2026-01-17T09:15:00Z",
    "status": "available",
    "errors": [],
    "warnings": [],
    "data": {
      "raw": {},
      "normalized": {}
    }
  },
  "telephony": {
    "collector": "telephony",
    "timestamp": "2026-01-17T09:15:00Z",
    "status": "available",
    "errors": [],
    "warnings": [],
    "data": {
      "raw": {},
      "normalized": {
        "sim_state": "ready",
        "phone_type": "gsm",
        "network_type": "lte"
      }
    }
  },
  "storage": {
    "collector": "storage",
    "timestamp": "2026-01-17T09:15:00Z",
    "status": "available",
    "errors": [],
    "warnings": [],
    "data": {
      "raw": {},
      "normalized": {}
    }
  },
  "security": {
    "collector": "security",
    "timestamp": "2026-01-17T09:15:00Z",
    "status": "available",
    "errors": [],
    "warnings": [],
    "data": {
      "raw": {},
      "normalized": {
        "selinux_mode": "enforcing",
        "debuggable": true,
        "adb_enabled": true
      }
    }
  },
  "environment_signals": {
    "collector": "environment_signals",
    "timestamp": "2026-01-17T09:15:00Z",
    "status": "available",
    "errors": [],
    "warnings": [],
    "data": {
      "raw": {
        "cmdline": "androidboot.hardware=ranchu androidboot.qemu=1"
      },
      "normalized": {
        "markers": {
          "qemu": true,
          "ranchu": true,
          "goldfish": true,
          "houdini": false,
          "waydroid": false,
          "anbox": false,
          "redroid": false,
          "virtualbox": false,
          "vbox": false,
          "genymotion": false,
          "lxc": false,
          "cuttlefish": false
        },
        "props": {
          "ro.kernel.qemu": "1",
          "ro.hardware.egl": "emulation",
          "ro.build.characteristics": "emulator"
        },
        "cgroup_readable": true,
        "cmdline_readable": true
      }
    }
  },
  "collector_status_summary": {
    "build": "available",
    "abi": "available",
    "cpu": "available",
    "gpu": "available",
    "vulkan": "available",
    "kernel": "available",
    "proc": "available",
    "sys": "available",
    "hardware_features": "available",
    "sensors": "available",
    "display": "available",
    "network": "available",
    "telephony": "available",
    "storage": "available",
    "security": "available",
    "environment_signals": "available"
  },
  "fingerprint_sha256": "6a88cdcf8b41e675af8fdeb59e1f32cdcbf1e517ad9b3797330fec61766af0c2"
}
